{
  "id": "pedaram-saeedi",
  "firstName": "Pedaram",
  "lastName": "Saeedi",
  "age": 28,
  "birthDate": null,
  "deathDate": "2025-01-09",
  "causeOfDeath": "Shot directly in the left chest by government forces",
  "incidentDate": "2025-01-09",
  "location": {
    "city": "Isfahan",
    "country": "Iran"
  },
  "status": "killed",
  "description": {
    "fa": "پدارم سعیدی، شهروند ۲۸ ساله و اهل اصفهان، روز جمعه ۱۹ دی ماه ۱۴۰۴ بر اثر شلیک مستقیم نیروهای حکومتی به سمت چپ سینه‌اش در میانه اعتراضات این شهر، بلافاصله جان خود را از دست داد. به گزارش هه‌نگاو، او در محل حادثه جان باخت.",
    "en": "Pedaram Saeedi, a 28-year-old citizen from Isfahan, died immediately on Friday, January 9, 2025 (19 Dey 1404) after being shot directly in the left chest by government forces during protests in the city. According to Hengaw, he died at the scene."
  },
  "events": [],
  "images": [
    "images/people/pedaram-saeedi/profile.png"
  ],
  "links": [
    {
      "url": "https://x.com/HengawO/status/2012211877313462274",
      "title": "Hengaw Report on Pedaram Saeedi's Death",
      "type": "news"
    }
  ],
  "verified": false,
  "published": false
}