{
  "id": "mino-majidi",
  "firstName": "Mino",
  "lastName": "Majidi",
  "age": null,
  "birthDate": null,
  "deathDate": "2022-09-21",
  "causeOfDeath": "gunshot wounds",
  "incidentDate": "2022-09-21",
  "location": {
    "city": "Kermanshah",
    "country": "Iran"
  },
  "status": "killed",
  "description": {
    "fa": "مینو مجیدی در جریان اعتراضات ضدحکومتی در کرمانشاه با اصابت گلوله جنگی کشته شد. مراسم خاکسپاری او به تجمع اعتراضی تبدیل شد.",
    "en": "Mino Majidi was killed by gunshot wounds during anti-government protests in Kermanshah. Her funeral turned into a protest against the authorities."
  },
  "events": ["2022-mahsa-amini-protests"],
  "images": [
    "images/people/mino-majidi/profile.jpeg"
  ],
  "links": [
    {
      "url": "https://fa.wikipedia.org/wiki/%D9%85%DB%8C%D9%86%D9%88_%D9%85%D8%AC%DB%8C%D8%AF%DB%8C",
      "title": "Wikipedia: Mino Majidi",
      "type": "news"
    }
  ],
  "verified": true,
  "published": true
}
