{
  "id": "ahmadreza-ghaderi",
  "firstName": "Ahmadreza",
  "lastName": "Ghaderi",
  "age": null,
  "birthDate": null,
  "deathDate": "2025-01-08",
  "causeOfDeath": "Killed during protests",
  "incidentDate": "2025-01-08",
  "location": {
    "city": "Babol",
    "country": "Iran"
  },
  "status": "killed",
  "description": {
    "fa": "احمدرضا قادری، دانشجوی ورودی ۹۹ مهندسی ساخت و تولید دانشگاه نوشیروانی بابل، شب پنجشنبه ۱۸ دی ۱۴۰۴ در اعتراضات کشته شد.",
    "en": "Ahmadreza Ghaderi, a 2020 entry student of Manufacturing Engineering at Noshirvani University of Babol, was killed on Thursday night, January 8, 2025 (18 Dey 1404) during protests."
  },
  "events": [],
  "images": [
    "images/people/ahmadreza-ghaderi/profile.jpeg"
  ],
  "links": [
    {
      "url": "https://x.com/AliTagh30207454/status/2012393530186977308",
      "title": "Twitter/X Report on Ahmadreza Ghaderi's Death",
      "type": "social_media"
    }
  ],
  "verified": false,
  "published": false
}